Radio móvil vs estacionaria,Compara las ventajas y desventajas entre radios móviles y estacionarias
Viajar con tu radio,Consejos para llevar tu equipo de radio en viajes y expediciones
La ciencia detrás de la radio,Entiende cómo funciona la radio desde un punto de vista científico
Proyectos DIY para radioaficionados,Inspírate con una serie de proyectos de bricolaje para radioaficionados
Radioafición y astronomía,Descubre la relación entre la radioafición y la observación astronómica
Mantenimiento de tu equipo,Aprende a realizar un mantenimiento básico a tu equipo de radio para prolongar su vida útil
Radioafición en el mar,Conoce cómo la radioafición se practica en el mar y las particularidades que conlleva
